search URL:,https://patents.google.com/?assignee=Sapience+Therapeutics&oq=Sapience+Therapeutics
id,title,assignee,inventor/author,priority date,filing/creation date,publication date,grant date,result link,representative figure link
IL-290414-A,Atf5 peptide variants and uses thereof ,Sapience Therapeutics Inc,,2018-01-03,2022-02-07,2022-04-01,,https://patents.google.com/patent/IL290414A/en,
WO-2018152446-A3,Cell-penetrating atf5 polypeptides and uses thereof ,"Sapience Therapeutics, Inc.","Barry Jay KAPPEL, Jimmy Andrew ROTOLO, Gene Merutka",2017-02-20,2018-02-17,2018-09-27,,https://patents.google.com/patent/WO2018152446A3/en,
WO-2021007158-A1,Modified bcl9 mimetic peptides ,"Sapience Therapeutics, Inc.","Barry Jay Kappel, Gene Merutka, Jimmy Andrew Rotolo, Erin E. GALLAGHER",2019-07-05,2020-07-06,2021-01-14,,https://patents.google.com/patent/WO2021007158A1/en,
WO-2021207517-A2,Modified hr2 peptide inhibitors of coronavirus fusion ,"Sapience Therapeutics, Inc.",Gene Merutka,2020-04-10,2021-04-08,2021-10-14,,https://patents.google.com/patent/WO2021207517A2/en,
WO-2021262604-A2,Administration of cebp-beta antagonist and methods of use ,"Sapience Therapeutics, Inc.","Barry Jay KAPPEL, Gene Merutka, Jimmy Andrew ROTOLO, Robert E. Michel, Alice Susannah BEXON",2020-06-21,2021-06-21,2021-12-30,,https://patents.google.com/patent/WO2021262604A2/en,
WO-2021195009-A1,Peptide antagonists of ace2-binding proteins ,"Sapience Therapeutics, Inc.","Barry Jay KAPPEL, Gene Merutka, Erin E. GALLAGHER",2020-03-23,2021-03-23,2021-09-30,,https://patents.google.com/patent/WO2021195009A1/en,
